"Ref_N","Reference"
1308,"Barlow, J., & Gerrodette, T. (1996). Abundance of cetaceans in California waters based on 1991 and 1993 ship surveys. NOAA Technical Memorandum NMFS/ NOAA-TM-NMFS-SWFSC-233 "
1309,"Barlow, J. (1995). The abundance of cetaceans in California waters. Part I: Ship surveys in summer and fall of 1991. Oceanographic Literature Review, 9(42), 784."
1310,"Branch, T. A., & Butterworth, D. S. (2001). Southern Hemisphere minke whales: standardised abundance estimates from the 1978/79 to 1997/98 IDCR-SOWER surveys. Journal of Cetacean Research and Management, 3(2), 143-174."
1311,"Waring, G. T., Nøttestad, L. E. I. F., Olsen, E., Skov, H., & Vikingsson, G. (2008). Distribution and density estimates of cetaceans along the mid-Atlantic Ridge during summer 2004. Journal of Cetacean Research and Management, 10(2), 137-146."
1312,"Macleod, K., Burt, L., Cañadas, A., Lens, S., Rogan, E., Santos, B., Uriarte, A., Van Canneyt, O., Vázquez, J.A. and Hammond, P.S. (2009). Distribution and Abundance of Fin whales and other baleen whales in the European Atlantic. Paper SC/61/RMP10 presented to the International Whaling Commission Scientific Committee, 16pp."
1313,"Bradford, A. L., Forney, K. A., Oleson, E. M., & Barlow, J. (2017). Abundance estimates of cetaceans from a line-transect survey within the US Hawaiian Islands Exclusive Economic Zone. Fishery Bulletin, 115:129–142"
1314,"Barlow, J. (2010). Cetacean abundance in the California Current estimated from a 2008 ship-based line-transect survey. NOAA-TM-NMFS-SWFSC-456"
1315,"Mullin, Keith & Fulling, Greg. (2006). Abundance of cetaceans in the oceanic northern Gulf of Mexico, 1996-2001. Marine Mammal Science. 20. 787"
1316,"Wade, P. R., & Gerrodette, T. (1993). Estimates of cetacean abundance and distribution in the eastern tropical Pacific. Report of the International Whaling Commission, 43(477-493)."
1317,"Becker EA, Forney KA, Oleson EM, Bradford AL, Moore JE, Barlow J. (2021). Habitat-based density estimates for cetaceans within the waters of the U.S. Exclusive Economic Zone around the Hawaiian Archipelago. U.S. Dept. of Commerce, NOAA Technical Memorandum NMFSPIFSC-116, 38 p. doi:10.25923/x9q9-rd73"
1318,"Barlow, J. (2006). Cetacean abundance in Hawaiian waters estimated from a summer/fall survey in 2002. Marine Mammal Science, 22(2), 446-464."
1319,"Hamilton, O.N.P., Fewster, R.M., Low, P., Johnson, F., Lea, C., Stockin, K.A., van der Linde, K., Constantine, R. (2024). Estimating abundance of a small population of Bryde’s whales: a comparison between aerial surveys and boat-based platforms of opportunity. Animal Conservation, 27(4), 426-436."
1320,"Branch, T. A. (2001). Abundance of Antarctic blue whales south of 60°S from three complete circumpolar sets of surveys. Journal of Cetacean Research and Management, 9(3):253–262."
1321,"Matsuoka, K., Hakamada, T., Kiwada, H., Murase, H., & Nishiwaki, S. (2006). Distributions and standardized abundance estimates for humpback, fin and blue whales in the Antarctic Areas IIIE, IV, V and VIW (35_ E-145_ W), south of 60_ S. IWC Paper."
1322,"Paarman, S., Vermeulen, E., Seyboth, E., Thornton, M., & Findlay, K. (2021). Abundance and distribution of Antarctic blue whales Balaenoptera musculus intermedia off the Queen Maud Land coast of Antarctica. African Journal of Marine Science, 43(1), 53-59."
1323,"Pike, D. G., Vﾒkingsson, G. A., Gunnlaugsson, T., & ﾯien, N. (2009). A note on the distribution and abundance of blue whales (Balaenoptera musculus) in the Central and Northeast North Atlantic. NAMMCO Scientific Publications, 7, 19-29."
1324,"Forney, K. A., & Barlow, J. (1998). Seasonal patterns in the abundance and distribution of California cetaceans, 1991–1992. Marine Mammal Science, 14(3), 460-489."
1325,"Williams, R., Hedley, S. L., Branch, T. A., Bravington, M. V., Zerbini, A. N., & Findlay, K. P. (2011). Chilean blue whales as a case study to illustrate methods to estimate abundance and evaluate conservation status of rare species. Conservation Biology, 25(3), 526-535."
1326,"Branch, T. A., & Butterworth, D. S. (2001). Estimates of abundance south of 60° S for cetacean species sighted frequently on the 1978/79 to 1997/98 IWC/IDCR-SOWER sighting surveys. J. Cetacean Res. Manage., 3(3), 251-270."
1327,"Campbell, G. S., Thomas, L., Whitaker, K., Douglas, A. B., Calambokidis, J., & Hildebrand, J. A. (2015). Inter-annual and seasonal trends in cetacean distribution, density and abundance off southern California. Deep Sea Research Part II: Topical Studies in Oceanography, 112, 143-157."
1328,"Best, P. B., Rademeyer, R. A., Burton, C., Ljungblad, D., Sekiguchi, K., Shimada, H., Thiele, D., Reeb, D., & Butterworth, D. S. (2003). The abundance of blue whales on the Madagascar Plateau, December 1996. Journal of Cetacean Research and Management 5:253–260"
1329,"Bedriñana-Romano, L., Zarate, P. M., Hucke-Gaete, R., Viddi, F. A., Buchan, S. J., Cari, I., Clavijo, L., Bello, R., Zerbini, A. N. (2022). Abundance and distribution patterns of cetaceans and their overlap with vessel traffic in the Humboldt Current Ecosystem, Chile. Scientific Reports, 12(1), 10639."
1330,"Beaubrun, P., David, L., Di-Mﾎglio, N., Gannier, A., & Gannier, O. (1997). First Aerial Survey in the North-west Mediterranean: preliminary results. European Research on Cetaceans, 11, 100-103."
1331,"Bauer, R. K., Fromentin, J. M., Demarcq, H., Brisset, B., & Bonhommeau, S. (2015). Cooccurrence and habitat use of fin whales, striped dolphins and Atlantic bluefin tuna in the Northwestern Mediterranean Sea. PloS one, 10(10),e0139218."
1332,"García‐Barón, I., Authier, M., Caballero, A., Vázquez, J. A., Santos, M. B., Murcia, J. L., & Louzao, M. (2019). Modelling the spatial abundance of a migratory predator: A call for transboundary marine protected areas. Diversity and Distributions, 25(3), 346-360."
1333,"Gannier, A., (1997). Estimation de l’abondance estivale du rorqual commun Balaenoptera physalus (Linné, 1758) dans le bassin liguro-provençal (Méditerranée nord-occidentale). Revue d’Ecologie la Terre et la Vie, 52, 69–86."
1334,"Pettex et al., 2014. Suivi Aérien de la Mégafaune Marine en France métropolitaine - Rapport final. Univ. Rochelle UMS 3462 - 169p. doi: 10.13140/2.1.2698.5287"
1335,"Leonard, D. M., & Øien, N. I. (2020). Estimated abundances of cetacean species in the Northeast Atlantic from two multiyear surveys conducted by Norwegian vessels between 2002-2013. NAMMCO Scientific Publications 11"
1336,"Forcada, J., Aguilar, A., Hammond, P., Pastor, X., & Aguilar, R. (1996). Distribution and abundance of fin whales (Balaenoptera physalus) in the western Mediterranean sea during the summer. Journal of Zoology, 238(1), 23-34."
1337,"Tepsich, P., Schettino, I., Atzori, F., Azzolin, M., Campana, I., Carosso, L.,  & Arcangeli, A. (2020). Trends in summer presence of fin whales in the WesternMediterraneaSea Region: new insights from a long-term monitoring program. PeerJ, 8, e10544."
1338,"Øien, N. (2009). Distribution and abundance of large whales in Norwegian and adjacent waters based on ship surveys 1995-2001. NAMMCO Scientific Publications, 7, 31-47."
1339,"Gannier, A., & Gannier, O. (1993). The winter presence of the Fin Whale in the liguro provencal basin: preliminary study. European Research on cetaceans, 7, 131-134."
1340,"Lauriano, G., Panigada, S., Canneri, R., & Manca Zeichen, M. (2009). Abundance estimate of striped dolphins (Stenella coeruleoalba) in the Pelagos Sanctuary (NW Mediterranean) by means of line transect surveys. J Cetacean Res Manag SC-61-SM25."
1341,"Fregosi, S., Harris, D. V., Matsumoto, H., Mellinger, D. K., Martin, S. W., Matsuyama, B., Barlow, J., Klinck, H. (2022). Detection probability and density estimation of fin whales by a Seaglider. The Journal of the Acoustical Society of America, 152(4), 2277-2291."
1342,"Forcada, J., Notarbartolo di Sciara, G. & Fabbri, F. (1995) Numbers of fin whales and striped dolphins summering in the Corso-Ligurian basin. Mammalia, 59, 127–140."
1343,"Panigada, S., Lauriano, G., Burt, L., Pierantonio, N., & Donovan, G. (2011). Monitoring winter and summer abundance of cetaceans in the Pelagos Sanctuary (northwestern Mediterranean Sea) through aerial surveys. PloS one, 6(7), e22878."
1344,"Laran, S., Joiris, C., Gannier, A., & Kenney, R. D. (2010). Seasonal estimates of densities and predation rates of cetaceans in the Ligurian Sea, northwestern Mediterranean Sea: an initial examination. J. Cetacean Res. Manage, 11(1), 31-40."
1345,"ACCOBAMS. (2021). Estimates of abundance and distribution of cetaceans, marine mega-fauna and marine litter in the Mediterranean Sea from 2018-2019 surveys. By Panigada S., Boisseau O., Canadas A., Lambert C., Laran S., McLanaghan R., Moscrop A. Ed. ACCOBAMS - ACCOBAMS Survey Initiative Project, Monaco, 177 pp."
1346,"Gannier, A., (1998). Une estimation de l’abondance estivale du dauphin bleu et blanc Stenella coeruleoalba (Meyen, 1833) dans le future sanctuaire marin international de Méditerranée  Nord-occidentale. Revue d'Ecologie la Terre et la Vie, 53, 255–271."
1347,"Heide-Jørgensen, M. P., Laidre, K. L., Simon, M., Burt, M. L., Borchers, D. L., & Rasmussen, M. (2010). Abundance of fin whales in West Greenland in 2007. Journal of Cetacean Research and Management, 11(2), 83-88."
1348,"Garrison, L. P. (2003). A marine mammal assessment survey of the Southeast US continental shelf, February-April 2002. U.S. Department of Commerce, Miami, Florida, USA. NOAA Technical Memorandum NOAA FISHERIES-SEFSC-492, 50 p."
1349,"Laran, S., Pettex, E., Authier, M., Blanck, A., David, L., Dorﾎmus, G., Falchetto, H., Monestiez, P., Van Canneyt, O., Ridoux, V. (2017). Seasonal distribution and abundance of cetaceans within French waters-Part I: The North-Western Mediterranean, including the Pelagos sanctuary. Deep Sea Research Part II: Topical Studies in Oceanography, 141, 20-30."
1350,"Leonard, D. M., & Øien, N. I. (2020). Estimated abundances of cetacean species in the Northeast Atlantic from Norwegian shipboard surveys conducted in 2014–2018. NAMMCO Scientific Publications, 11."
1351,"Cominelli, S., Moulins, A., Rosso, M. and Tepsich, P. (2016), Fin whale seasonal trends in the Pelagos Sanctuary, Mediterranean Sea. Journal of Wildlife Management, 80: 490-499"
1352,"Notarbartolo di Sciara, G., Forcada, J., Acquarone, M., & Fabbri, F. (1993). Population estimates of fin whales and striped dolphins summering in the Corso-Ligurian Basin. European Research on cetaceans, 7, 135-138."
1353,"Víkingsson, G. A., Pike, D. G., Desportes, G., Øien, N., Gunnlaugsson, T., & Bloch, D. (2009). Distribution and abundance of fin whales (Balaenoptera physalus) in the Northeast and Central Atlantic as inferred from the North Atlantic Sightings Surveys 1987-2001. NAMMCO Sci. Publ, 7, 49-72."
1354,"Gannier, A. (2006). Le peuplement estival de cﾎtacﾎs dans le Sanctuaire Marin Pelagos (Mﾎditerranﾎe nord-occidentale): distribution et abondance/Summer cetacean popoulation in the Pelagos Marine Sanctuary (northwest Mediterranean): distribution and abundance. Mammalia, 70(1-2), 17-27."
1355,"Gannier, A. (1997). Summer abundance estimates of striped dolphins and fin whales in the area of the future International Marine Sanctuary. European Research on Cetaceans, 11, 95-98."
1356,"Branch, T. A. (2011). Humpback whale abundance south of 60°S from three complete circumpolar sets of surveys. Journal of Cetacean Research and Management, 3:53–69."
1357,"Pavanato, H., Wedekin, L., Guilherme-Silveira, F. R., Engel, M. H., Kinas, P. G. (2017). Estimating humpback whale abundance using hierarchical distance sampling. Ecological Modelling, 358, 10-18"
1358,"Heide-Jørgensen, M. P., Laidre, K. L., Hansen, R. G., Burt, M. L., Simon, M., Borchers, D. L., Hansen, J., Harding, K., Rasmussen, M., Dietz, R., Teilmann, J. (2012). Rate of increase and current abundance of humpback whales in West Greenland. Journal of Cetacean Research and Management, 12(1), 1-14."
1359,"Zerbini, A. N., Andriolo, A., Da Rocha, J. M., Simões-Lopes, P. C., Siciliano, S., Pizzorno, J. L., Waite, J. M., Demaster, D. P., Vanblaricom, G. R. (2004). Winter distribution and abundance of humpback whales (Megaptera novaeangliae) off Northeastern Brazil. Journal of Cetacean Research and Management, 6(1), 101-107."
1360,"Bezamat, C., Wedekin, L. L., and Simões-Lopes, P. C. (2015) Potential ship strikes and density of humpback whales in the Abrolhos Bank breeding ground, Brazil. Aquatic Conserv: Mar. Freshw. Ecosyst., 25: 712– 725."
1361,"Johannessen, J. E. D., Biuw, M., Lindstrøm, U., Ollus, V. M. S., Martín López, L. M., Gkikopoulou, K. C., Oosthuizen, W.C., Lowther, A. (2022). Intra‐season variations in distribution and abundance of humpback whales in the West Antarctic Peninsula using cruise vessels as opportunistic platforms. Ecology and evolution, 12(2), e8571."
1362,"Secchi, E. R., Dalla Rosa, L., Kinas, P. G., Nicolette, R. F., Rufino, A. N., & Azevedo, A. F. (2020). Encounter rates and abundance of humpback whales (Megaptera novaeangliae) in Gerlache and Bransfield Straits, Antarctic Peninsula. J. Cetacean Res. Manage., 107-111."
1363,"Andriolo, A., Martins, C. C. A., Engel, M. H., Pizzorno, J. L., Más-Rosa, S., Freitas, A. C., Morete, M. E. and Kinas, P. G. (2006). The first aerial survey to estimate abundance of humpback whales (Megaptera movaeangliae) in the breeding ground off Brazil (Breeding Stock A). Journal of Cetacean Research and Management, 8(3), 307."
1364,"Bortolotto, G. A., Danilewicz, D., Andriolo, A., Secchi, E. R., & Zerbini, A. N. (2016). Whale, whale, everywhere: increasing abundance of western South Atlantic humpback whales (Megaptera novaeangliae) in their wintering grounds. PLoS One, 11(10), e0164596."
1365,"Bariyanga, J. D., Apio, A., Wronski, T., & Plath, M. (2016). Effectiveness of electro-fencing for restricting the ranging behaviour of wildlife: a case study in the degazetted parts of Akagera National Park. African zoology, 51(4), 183-191."
1366,"East R. (1999). African Antelope Database 1998. IUCN/SSC Antelope Specialist Group. IUCN, Gland, Switzerland and Cambridge, UK. x + 434pp."
1367,"Fryxell, J. M., Mduma, S., Masoy, J., Sinclair, A. R., Hopcraft, G. J., & Packer, C. (2022). Stabilizing effects of group formation by Serengeti herbivores on predator-prey dynamics. Frontiers in Ecology and Evolution, 10, 981842."
1368,"Power, R. J. (2002). Prey selection of lions Panthera leo in a small, enclosed reserve.ﾠKoedoe,ﾠ45(2), 67-75."
1369,"Dunham, K. M. (1994). The Effect of Drought on the Large Mammal Populations of Zambezi Riverine Woodlands. Journal of Zoology 234: 489-526"
1370,"Caro, T. M., et al. (1998). The impact of tourist hunting on large mammals in Tanzania: an initial assessment. African Journal of Ecology, 36(4), 321-346."
1371,"Lamprey, H. F. (1964). Estimation of the large mammal densities, biomass and energy exchange in the Tarangire Game Reserve and the Masai Steppe in Tanganyika. African Journal of Ecology, 2(1), 1-46."
1372,"Wilfred, P., & MacColl, A. D. (2016). Status of wildlife at trophy hunting sites in the Ugalla Game Reserve of Western Tanzania. Tropical Conservation Science, 9(3), 1940082916667336."
1373,"Schuette, P., Creel, S., & Christianson, D. (2016). Ungulate distributions in a rangeland with competitors, predators and pastoralists. Journal of Applied Ecology, 53(4), 1066-1077."
1374,"Hayward, M. W., OﾒBrien, J., & Kerley, G. I. (2007). Carrying capacity of large African predators: predictions and tests.ﾠBiological Conservation,ﾠ139(1-2), 219-229."
1375,"Augustine, D. J. (2010). Response of native ungulates to drought in semi‐arid Kenyan rangeland. African Journal of Ecology, 48(4), 1009-1020."
1376,"Rija, A. A., & Hassan, S. N. (2011). Population density estimates of some species of wild ungulates in Simanjiro plains, northern Tanzania. African Journal of Ecology, 49(3), 370."
1377,"Hunter, L. T. (2007).ﾠThe behavioural ecology of reintroduced lions and cheetahs in the Phinda Resource Reserve, KwaZulu-Natal, South Africaﾠ(Doctoral dissertation, University of Pretoria)."
1378,"Greene, K., Bell, D., Kioko, J., & Kiffner, C. (2017). Performance of ground-based and aerial survey methods for monitoring wildlife assemblages in a conservation area of northern Tanzania. European Journal of Wildlife Research, 63, 1-13."
1379,"Gaidet, N., Fritz, H., & Nyahuma, C. (2003). A participatory counting method to monitor populations of large mammals in non-protected areas: a case study of bicycle counts in the Zambezi Valley, Zimbabwe. Biodiversity & Conservation, 12(8), 1571-1585."
1380,"Macdonald, D. (2001). The New Encyclopedia of Mammals. Oxford. Oxford University Press. 930"
1381,"Hayward, M. W., O'Brien, J., & Kerley, G. I. (2007). Carrying capacity of large African predators: predictions and tests.ﾠBiological Conservation,ﾠ139(1-2), 219-229."
1382,"Van Dyk, G., & Slotow, R. (2003). The effects of fences and lions on the ecology of African wild dogs reintroduced to Pilanesberg National Park, South Africa.ﾠAfrican Zoology,ﾠ38(1), 79-94."
1383,"Oladipo, O. S., Folorunso, A. A., Lewiska, L. F., & Akeem, L. G. (2019). Population Density, Diversity and Abundance of Antelope Species in Kainji Lake National Park, Nigeria. Open Journal of Ecology, 9(4): 107-116"
1384,"Kasiringua, E., Procheş, Ş., & Kopij, G. (2020). Long-Term Population Dynamics of African Ungulates in Waterberg Plateau National Park, Namibia. Polish Journal of Ecology, 67(4), 339-353."
1385,"Keeping, D., Burger, J. H., Keitsile, A. O., Gielen, M. C., Mudongo, E., Wallgren, M., Skarpe, C., & Foote, A. L. (2018). Can trackers count free-ranging wildlife as effectively and efficiently as conventional aerial survey and distance sampling? Implications for citizen science in the Kalahari, Botswana. Biological Conservation, 223, 156-169."
1386,"Yaduma, Z. B., Zacharia, B., Anguruwa, G. T., & Shem, E. M. (2023). Population density and feeding behaviour of western hartebeest (Alcelaphus buselaphus, Major) in Borgu Sector of Kainji Lake National Park, Nigeria. Journal of Research in Forestry, Wildlife and Environment, 15(4), 217-227."
1387,"Latif, M. A., Hussain, T., Naseer, J., Saeed, A., Altaf, M., Rafay, M., & Khan, E. U. Population Dynamics and Diurnal Budget of Behavioral Activities of BlackBuck (Antilope cervicapra) at three protected areas in Cholistan Desert. Journal of Xi’an Shiyou University, Natural Science Edition 20(5): 558-581"
1388,"Baskaran, N., Ramkumaran, K., & Karthikeyan, G. (2016). Spatial and dietary overlap between blackbuck (Antilope cervicapra) and feral horse (Equus caballus) at Point Calimere Wildlife Sanctuary, Southern India: Competition between native versus introduced species. Mammalian Biology, 81, 295-302."
1389,"Awasthi, N., Kumar, U., Qureshi, Q., Pradhan, A., Chauhan, J. S., & Jhala, Y. V. (2016). Effect of human use, season and habitat on ungulate density in Kanha Tiger Reserve, Madhya Pradesh, India. Regional Environmental Change, 16, 31-41."
1390,"Ashokkumar, M., & Nagarajan, R. (2023). Population Density and Age-Sex Composition of Large Mammals in Tropical Forests, Southern India. in ""Tropical Forests - Ecology, Diversity and Conservation Status"" eds (Carmona, Musarella, Ortiz)."
1391,"Jathanna et al. (2003). Estimation of large herbivore densities in the tropical forests of southern India using distance sampling. J. Zool., Lond. 261: 285–290"
1392,"Madhusudan, M. D., & Karanth, K. U. (2000). Hunting for an answer: is local hunting compatible with large mammal conservation in India. Hunting for sustainability in tropical forests, 1, 339-355."
1393,"Kumar, N. S., & Karanth, K. U. Ecological determinants of density patterns of gaur (Bos gaurus) in Nagarahole-Bandipur reserves in the Western Ghats of India. BULLetin 5: 27-40"
1394,"Varma, S. (2007). Population Estimation of Mammals in Nagerhole National Park: Validation of the results from Large Mammal Census and Long-term Study from Rajiv Gandhi National Park (Nagarahole NP). Asian Elephant Research & Conservation Centre (A Division of Asian Nature Foundation), C/o Centre for Ecological Sciences, Indian Institute of Science, Bangalore."
1395,"Biswas, S., & Sankar, K. (2002). Prey abundance and food habit of tigers (Panthera tigris tigris) in Pench National Park, Madhya Pradesh, India. Journal of Zoology, 256(3), 411-420."
1396,"Laichanthuek, P., Sukmasuang, R., & Duengkae, P. Population and habitat use of Gaur (Bos gaurus) around Khao Phaeng Ma non-hunting Area, Nakhon Ratchasima province. Population and habitat use of Gaur (Bos gaurus) around Khao Phaeng Ma non-hunting Area, Nakhon Ratchasima province. Journal of Wildlife of Thailand 24(2560): 83-95"
1397,"Gopalaswamy, A. M., Karanth, K. U., Kumar, N. S., & Macdonald, D. W. (2012). Estimating tropical forest ungulate densities from sign surveys using abundance models of occupancy. Animal Conservation, 15(6), 669-679."
1398,"Karanth, K. U., & Sunquist, M. E. (1992). Population structure, density and biomass of large herbivores in the tropical forests of Nagarahole, India. Journal of Tropical Ecology, 8(01), 21-35."
1399,"Harris & Loggers. (2004). Status of Tibetan plateau mammals in Yeniugou, China. Wildl. Biol. 10: 91-99"
1400,"Gardner, P. C., Vaughan, I. P., Liew, L. P., & Goossens, B. (2019). Using natural marks in a spatially explicit capture-recapture framework to estimate preliminary population density of cryptic endangered wild cattle in Borneo. Global Ecology and Conservation, e00748."
1401,"Singh, A., Mukherjee, A., Dookia, S., & Kumara, H. N. (2017). An updated account of mammal species and population status of ungulates in Keoladeo National Park, Bharatpur, Rajasthan. Current Science, 113(1), 103."
1402,"Mehta, D., & Soni, V. C. (2018). Wild Ungulates in A Human Dominated Landscape: Their Population Structure, Density and Biomass in Western India. International Journal of Ecology and Environmental Sciences, 44(3), 319-329."
1403,"Khan, J. A., Chellam, R., Rodgers, W. A., & Johnsingh, A. J. T. (1996). Ungulate densities and biomass in the tropical dry deciduous forests of Gir, Gujarat, India. Journal of Tropical Ecology, 12(1), 149-162."
1404,"Gupta, D., & Krishnamurthy, R. (2023). Spatial density patterns of herbivore response to seasonal dynamics in the tropical deciduous forest of central India. Biotropica, 55(2), 430-443."
1405,"Dinerstein, E. (1980). An ecological survey of the Royal Karnali-Bardia Wildlife Reserve, Nepal: Part III: Ungulate populations. Biological Conservation, 18(1), 5-37."
1406,"Bagchi, S., Goyal, S. P., & Sankar, K. (2003). Prey abundance and prey selection by tigers (Panthera tigris) in a semi-arid, dry deciduous forest in western India. Journal of Zoology, 260(3), 285-290."
1407,"张锦栋.(2024).陕西秦岭羚牛的空间分布及保护管理对策(硕士学位论文,西北农林科技大学). https://kns.cnki.net/kcms2/article/abstract?v=FruxrO_GJXKR1QpOAf4Zqtj1SxVFLVr5oO3mrqBEvaKDRgUPMQJIZ4Xw0Aa0lbp_cX46KSBpkJJ0JZyoCIYkNFx32jTUIZYHMjoxk3ihEZj5IgA0CZnBt4WGme3LaEVA4Idr42m9ge0=&uniplatform=NZKPT&language=CHS"
1408,"Haider, J., Rakha, B. A., Anwar, M., Khan, M. Z., & Ali, H. (2021). An updated population status of Astor Markhor (Capra falconeri falconeri) in Gilgit-Baltistan, Pakistan. Global Ecology and Conservation, 27, e01555."
1409,"Brambilla, A., Von Hardenberg, A., Nelli, L., & Bassano, B. (2020). Distribution, status, and recent population dynamics of Alpine ibex Capra ibex in Europe. Mammal Review, 50(3), 267-277."
1410,"de Prada, C., Cortés, J. H., García-Serrano, A., Arberas, O. F., & Gómez, C. (2019). Estimating Iberian Wild Goat Abundance in a Large Rugged Forest Habitat. Pirineos, (174), 50-57."
1411,"Ahmad, S., Ali, H., Asif, M., Khan, T., Din, N., Rehman, E. U., Hameed, S., Ub Din, J., Nawaz, M. A. (2022). Spatial Density Pattern of Himalayan Ibex (Capra sibirica) in Pakistan. Global Ecology and Conservation, e02288."
1412,"Khan, B., Ablimit, A., Khan, G., Jasra, A. W., Ali, H., Ali, R., Ahmad, E., & Ismail, M. (2016). Abundance, distribution and conservation status of Siberian ibex, Marco Polo and Blue sheep in Karakoram-Pamir mountain area. Journal of King Saud University-Science, 28(3), 216-225."
1413,"Khan, M. Z., Begum, F., Riaz, M., Khan, B., Karim, R., Ali, K., & Aman, S. (2019). Predicting the potential impacts of trophy hunting on population structure of Himalayan ibex (Capra sibirica) in northern Pakistan. Polish Journal of Ecology, 67(3), 264-270."
1414,"Schaller, G. B., Hong, L., Hua, L., Junrang, R., Mingjiang, Q., & Haibin, W. (1987). Status of large mammals in the Taxkorgan Reserve, Xinjiang, China. Biological conservation, 42(1), 53-71."
1415,"Khanyari, M., Luecke, S., Mishra, C., & Suryawanshi, K. R. (2020). Understanding population baselines: status of mountain ungulate populations in the Central Tien Shan Mountains, Kyrgyzstan. Mammalia, 85(1), 16-23."
1416,"Wu, D., MaMing, R., Xu, G., Zhu, X., & Buzzard, P. (2015) Relationship between ibex and snow leopard about food chain and population density in Tian Shan. Selevinia, 23, 186-190"
1417,"Xu, F., Ma, M., Wu, Y-q. (2007). Population density and habitat utilization of ibex (Capra ibex) in Tomur National Nature Reserve, Xinjiang, China. Zoological Researc 28(1): 53-55"
1418,"Ejigu, D., Bekele, A., & Powell, L. (2017). Walia ibex have increased in number and shifted their habitat range within Simien Mountains National Park, Ethiopia. Journal of Mountain Ecology, 10, 27-44."
1419,"Berhane, D. E. (2012). Population Status and Ecology of walia ibex (Capra walie): A study to address its Conservation in Simien Mountains National Park, Ethiopia. PhD Thesis, The Department of Zoological Sciences, Addis Abeba University"
