"Ref_N","Reference"
760,"Kauhala, K., Holmala, K., Lammers, W., & Schregel, J. (2006). Home ranges and densities of medium-sized carnivores in south-east Finland, with special reference to rabies spread. Acta Theriologica, 51(1), 1-13."
761,"Selonen, V., Brommer, J. E., Klangwald, C., & Laaksonen, T. (2024). Successful invasion: camera trap distance sampling reveals higher density for invasive raccoon dog compared to native mesopredators. Biological Invasions, 26, 1-10."
762,"Kamler, J. F., Stenkewitz, U., & Macdonald, D. W. (2013). Lethal and sublethal effects of black-backed jackals on cape foxes and bat-eared foxes. Journal of Mammalogy, 94(2), 295-306."
763,"Mackie, J. A. J. (1989). Habitat selection, home range use, and group size of bat-eared foxes in the Orange Free State. South African Journal of Wildlife Research-24-month delayed open access, 19(4), 135-139."
764,"Lord Jr, R. D. (1961). A population study of the gray fox. American Midland Naturalist, 87-109."
765,"Hernández-Sánchez, A., Santos-Moreno, A., & Pérez-Irineo, G. (2017). Abundance of mesocarnivores in two vegetation types in the southeastern region of Mexico. The Southwestern Naturalist, 62(2), 101-108."
766,"King, J. L., Duncan, C. L., & Garcelon, D. K. (2014). Status of the Santa Catalina Island Fox thirteen years after its decline. Monographs of the Western North American Naturalist, 382-396."
767,"Sanchez, J. N., & Hudgens, B. R. (2015). Interactions between density, home range behaviors, and contact rates in the Channel Island fox (Urocyon littoralis). Ecology and Evolution, 5(12), 2466-2477."
768,"Lenain, D. M., Olfermann, E., & Warrington, S. (2004). Ecology, diet and behaviour of two fox species in a large, fenced protected area in central Saudi Arabia. Journal of Arid Environments, 57(1), 45-60."
769,"Sarmento, P., Cruz, J., Eira, C., & Fonseca, C. (2009). Evaluation of camera trapping for estimating red fox abundance. The Journal of Wildlife Management, 73(7), 1207-1212."
770,"Ruette, S., Stahl, P., & Albaret, M. (2003). Applying distance‐sampling methods to spotlight counts of red foxes. Journal of Applied Ecology, 40(1), 32-43."
771,"Jimenez, J., Chandler, R., Tobajas, J., Descalzo, E., Mateo, R., & Ferreras, P. (2019). Generalized spatial mark–resight models with incomplete identification: An application to red fox density estimates. Ecology and Evolution, 9(8), 4739-4748."
772,"Goszczyński, J. (1977). Connections between predatory birds and mammals and their prey. Acta theriologica, 22(30), 399-430."
773,"Quinn, C. B., Alden, P. B., & Sacks, B. N. (2019). Noninvasive sampling reveals short-term genetic rescue in an insular red fox population. Journal of Heredity, 110(5), 559-576."
774,"Carter, A., Potts, J. M., & Roshier, D. A. (2019). Toward reliable population density estimates of partially marked populations using spatially explicit mark–resight methods. Ecology and Evolution, 9(4), 2131-2141."
775,"Soulsbury, C. D., Iossa, G., Baker, P. J., Cole, N. C., Funk, S. M., & Harris, S. (2007). The impact of sarcoptic mange Sarcoptes scabiei on the British fox Vulpes vulpes population. Mammal Review, 37(4), 278-296."
776,"Pandolfi, M., Santolini, R., & Bonacoscia, M. (1991). Spotlight census of the red fox (Vulpes vulpes) and the domestic cat (Felis catus) in three sample areas of the Marches region (Central Italy)/Censimento notturno di Volpe (Vulpes vulpes) e di Gatto domestico (Felis catus) in tre aree campione delle Marche. Hystrix-the Italian Journal of Mammalogy, 3(1)."
777,"Read, J., & Bowen, Z. (2001). Population dynamics, diet and aspects of the biology of feral cats and foxes in arid South Australia. Wildlife Research, 28(2), 195-203."
778,"Lindsø, L. K., Dupont, P., Rød-Eriksen, L., Andersskog, I. P. Ø., Ulvund, K. R., Flagstad, Ø., Bischof, R., Eide, N. E. (2021). Estimating red fox density using non-invasive genetic sampling and spatial capture–recapture modelling. Oecologia, 198, 139-151"
779,"Trewby, I. D., Wilson, G. J., Delahay, R. J., Walker, N., Young, R., Davison, J., Cheeseman, C., Robertson, P.A., Gorman, M.L., McDonald, R. A. (2008). Experimental evidence of competitive release in sympatric carnivores. Biology letters, 4(2), 170-172."
780,"Palencia, P., Rowcliffe, J. M., Vicente, J., & Acevedo, P. (2021). Assessing the camera trap methodologies used to estimate density of unmarked populations. Journal of Applied Ecology, 58(8), 1583-1592."
781,"Panek, M., & Bresiński, W. (2002). Red fox Vulpes vulpes density and habitat use in a rural area of western Poland in the end of 1990s, compared with the turn of 1970s. Acta Theriologica, 47(4), 433-442."
782,"Goldyn, B., Hromada, M., Surmacki, A., & Tryjanowski, P. (2003). Habitat use and diet of the red foxVulpes vulpes in an agricultural landscape in Poland. Zeitschrift für Jagdwissenschaft, 49(3), 191-200."
783,"Heydon, M. J., Reynolds, J. C., & Short, M. J. (2000). Variation in abundance of foxes (Vulpes vulpes) between three regions of rural Britain, in relation to landscape and other variables. Journal of Zoology, 251(2), 253-264."
784,"Mason, S. S., Hill, R. A., Whittingham, M. J., Cokill, J., Smith, G. C., & Stephens, P. A. (2022). Camera trap distance sampling for terrestrial mammal population monitoring: lessons learnt from a UK case study. Remote Sensing in Ecology and Conservation, 8(5), 717-730."
785,"Panek, M., Kamieniarz, R., & Bresiński, W. (2006). The effect of experimental removal of red foxes Vulpes vulpes on spring density of brown haresLepus europaeus in western Poland. Acta Theriologica, 51(2), 187-193."
786,"Guislain, M. H., Raoul, F., Poulle, M. L., & Giraudoux, P. (2007). Fox faeces and vole distribution on a local range: ecological data in a parasitological perspective for Echinococcus multilocularis. Parasite, 14(4), 299-308."
787,"Singh, N., Bhatt, U., Chaudhary, S., & Lyngdoh, S. (2024). Field testing of abundance estimation methods for monitoring mammals in tropical mountainous forests: a case study of Simbalbara Wildlife Sanctuary and Churdhar Wildlife Sanctuary, Himachal Pradesh, India. ResearchSquare, doi: 10.21203/rs.3.rs-1668246/v1"
788,"Insley H. (1977). An estimate of the population density of the red fox (Vulpes vulpes) in the New Forest, Hampshire. Journal of Zoology, 183(4), 549-553."
789,"Gerber, B. D., Karpanty, S. M., & Randrianantenaina, J. (2012). The impact of forest logging and fragmentation on carnivore species composition, density and occupancy in Madagascar's rainforests. Oryx, 46(3), 414-422."
790,"Hawkins & Racey. (2005). Low population density of a tropical forest carnivore, Cryptoprocta ferox: implications for protected area management. Oryx 39(1): 35-43"
791,"Gerber, B., Karpanty, S. M., Crawford, C., Kotschwar, M., & Randrianantenaina, J. (2010). An assessment of carnivore relative abundance and density in the eastern rainforests of Madagascar using remotely-triggered camera traps. Oryx, 44(2), 219-222."
792,"Gerber, B. D., Karpanty, S. M., & Kelly, M. J. (2012). Evaluating the potential biases in carnivore capture–recapture studies associated with the use of lure and varying density estimation techniques using photographic-sampling data of the Malagasy civet. Population Ecology, 54(1), 43-54."
793,"Woolaver, L., Nichols, R., Rakotombololona, W. F., Volahy, A. T., & Durbin, J. (2006). Population status, distribution and conservation needs of the narrow-striped mongoose Mungotictis decemlineata of Madagascar. Oryx, 40(1), 67-75."
794,"Okello, M. M., Kenana, L., Maliti, H., Kiringe, J. W., Kanga, E., Warinwa, F., Bakari, S., Ndambuki, S., Massawe, E., Sitati, N., Kimutai, D. Mwita, M., Gichohi, N., Muteti, D., Ngoru, B, Mwangi, P. & Kimutai, D. (2016). Population density of elephants and other key large herbivores in the Amboseli ecosystem of Kenya in relation to droughts. Journal of Arid Environments, 135, 64-74."
795,"Broekhuis, F., & Gopalaswamy, A. M. (2016). Counting cats: Spatially explicit population estimates of cheetah (Acinonyx jubatus) using unstructured sampling data. PLoS One, 11(5), e0153875."
796,"Wearn, O. R., Bell, T. E., Bolitho, A., Durrant, J., Haysom, J. K., Nijhawan, S., Thorley, J., & Rowcliffe, J. M. (2022). Estimating animal density for a community of species using information obtained only from camera-traps.ﾠ Methods in Ecology and Evolution,ﾠ 13(10), 2248-2261."
797,"Hamer, R. P., Gardiner, R. Z., Proft, K. M., Johnson, C. N., & Jones, M. E. (2021). A triple threat: high population density, high foraging intensity and flexible habitat preferences explain high impact of feral cats on prey. Proceedings of the Royal Society B, 288(1942), 20201194."
798,"Tennent, J., & Downs, C. T. (2008). Abundance and home ranges of feral cats in an urban conservancy where there is supplemental feeding: a case study from South Africa. African Zoology, 43(2), 218-229."
799,"Cove, M. V., Herrmann, V., Herrera, D. J., Augustine, B. C., Flockhart, D. T., & McShea, W. J. (2023). Counting the Capital's cats: Estimating drivers of abundance of free‐roaming cats with a novel hierarchical model. Ecological Applications, 33(2), e2790."
800,"Hamer, R. P., Andersen, G. E., Hradsky, B. A., Troy, S. N., Gardiner, R. Z., Johnson, C. N., & Jones, M. E. (2021). Differing effects of productivity on home-range size and population density of a native and an invasive mammalian carnivore. Wildlife Research, 49(2), 158-168."
801,"Calhoon, R. E., & Haspel, C. (1989). Urban cat populations compared by season, subhabitat and supplemental feeding. The Journal of Animal Ecology, 321-328."
802,"Normand, C., Urbanek, R. E., & Gillikin, M. N. (2018). Population density and annual and seasonal space use by feral cats in an exurban area. Urban Ecosystems, 1-11."
803,"Rees, M. W., Pascoe, J. H., Le Pla, M., Robley, A., Birnbaum, E. K., Wintle, B. A., & Hradsky, B. A. (2023). Mesopredator release among invasive predators: Controlling red foxes can increase feral cat density and alter their behaviour. Journal of Applied Ecology, 60(6), 1100-1114."
804,"Davies, H. F., Rangers, T. L., Rees, M. W., Stokeld, D., Miller, A. C., Gillespie, G. R., & Murphy, B. P. Variation in feral cat density between two large adjacent islands in Australia’s monsoon tropics.Pacific Conservation Biology, 28(1), 18-24."
805,"Sparkes, J., Fleming, P. J., McSorley, A., & Mitchell, B. (2021). How many feral cats can be individually identified from camera trap images? Population monitoring, ecological utility and camera trap settings. Ecological Management & Restoration, 22(3), 246-255."
806,"Nussberger, B., Hertwig, S. T., & Roth, T. (2023). Monitoring distribution, density and introgression in European wildcats in Switzerland. Biological Conservation, 281, 110029."
807,"Soto, E. J., Nunes, J., Nóbrega, E., Palmeirim, A. F., & Rocha, R. (2023). Density and ecological drivers of free‐ranging cat abundance and activity in Madeira Island, Macaronesia. Conservation Science and Practice, 5(12), e13040."
808,"Genovesi, P., Besa, M., & Toso, S. (1995). Ecology of a feral cat Felis catus population in an agricultural area of northern Italy. Wildlife biology, 1(1), 233-238."
809,"Chatterjee, N., Nigam, P., & Habib, B. (2020). Population density and habitat use of two sympatric small cats in a central Indian reserve. Plos one, 15(6), e0233569."
810,"Ünal, Y., & Eryilmaz, A. (2020) Jungle cat (Felis chaus Schreber 1977) population density estimates, activity pattern and spatiotemporal interactions with humans and other wildlife species in Turkey. Applied Ecology and Environmental Research, 18(4): 5873-5890."
811,"Anile, S., Augugliaro, C., Munkhtsog, B., Dartora, F., Vendramin, A., Bombieri, G., & Nielsen, C. K. (2021). Density and activity patterns of Pallas’s cats, Otocolobus manul, in central Mongolia. Wildlife Research, 48(3), 264-272."
812,"Gil-Sánchez, J. M., Barea-Azcón, J. M., Jaramillo, J., Herrera-Sánchez, F. J., Jiménez, J., & Virgós, E. (2020). Fragmentation and low density as major conservation challenges for the southernmost populations of the European wildcat. PloS one, 15(1), e0227708."
813,"Can, Ö. E., Kandemi̇r, İ., & Togan, İ. (2011). The wildcat Felis silvestris in northern Turkey: assessment of status using camera trapping. Oryx, 45(1), 112-118."
814,"Sayol, F., Vilella, M., Bagaria, G., & Puig, J. (2018). El gat salvatge, Felis silvestris (Schreber, 1777), al Prepirineu oriental: densitat de les poblacions del Lluçanès i el Bisaura. Butlletí de la Institució Catalana d'Història Natural, 185-191."
815,"Kery, M., Gardner, B., Stoeckle, T., Weber, D., & Royle, J. A. (2011). Use of spatial capture‐recapture modeling and DNA data to estimate densities of elusive animals. Conservation biology, 25(2), 356-364."
816,"Kilshaw, K., Johnson, P. J., Kitchener, A. C., & Macdonald, D. W. (2015). Detecting the elusive Scottish wildcat Felis silvestris silvestris using camera trapping. Oryx, 49(2), 207-215."
817,"Matias, G., Rosalino, L. M., Rosa, J. L., & Monterroso, P. (2021). Wildcat population density in NE Portugal: A regional stronghold for a nationally threatened felid. Population Ecology, 63(3), 247-259."
818,"Anile, S., Ragni, B., Randi, E., Mattucci, F., & Rovero, F. (2014). Wildcat population density on the Etna volcano, Italy: a comparison of density estimation methods. Journal of Zoology, 293(4), 252-261."
819,"Anile, S., Bizzarri, L., & Ragni, B. (2009). Camera trapping the European wildcat (Felis silvestris silvestris) in Sicily (Southern Italy): preliminary results. Hystrix Ital. J. Mammal.(ns), 20(1), 55-60."
820,"Fonda, F., Bacaro, G. & Battistella, S., Chiatante, G., Pecorella, S., Pavanello, M. (2021). Population density of European wildcats in a pre-alpine area (northeast Italy) and an assessment of estimate robustness. Mammal Research, 67: 9–20"
821,"Anile, S., Amico, C., & Ragni, B. (2012). Population density estimation of the European wildcat (Felis silvestris silvestris) in Sicily using camera trapping. Wildlife Biology in Practice, 8(1), 1-12."
822,"Huaranca, J. C., Villalba, M. L., Negrões, N., Jiménez, J. E., Macdonald, D. W., & Pacheco, L. F. (2020). Density and activity patterns of Andean cat and pampas cat (Leopardus jacobita and L. colocolo) in the Bolivian Altiplano. Wildlife Research, 47(1), 68-76."
823,"Caruso, N., Manfredi, C., Vidal, E. M. L., Casanaveo, E. B., & Lucherinio, M. (2012). First density estimation of two sympatric small cats, Leopardus colocolo and Leopardus geoffroyi, in a shrubland area of central Argentina. Annales Zoologici Fennici 49(3): 181-192"
824,"Tirelli, F. P. et al. (2019). Density and spatio-temporal behaviour of Geoffroy's cats in a human-dominated landscape of southern Brazil. Mammalian Biology 99: 128-135"
825,"Pereira, J. A., Di Bitetti, M. S., Fracassi, N. G., Paviolo, A., De Angelo, C. D., Di Blanco, Y. E., & Novaro, A. J. (2011). Population density of Geoffroy's cat in scrublands of central Argentina. Journal of Zoology, 283(1), 37-44."
826,"Di Bitetti, M. S., Paviolo, A., & De Angelo, C. (2006). Density, habitat use and activity patterns of ocelots (Leopardus pardalis) in the Atlantic Forest of Misiones, Argentina. Journal of Zoology, 270(1), 153-163."
827,"Di Bitetti, M. S., Paviolo, A., De Angelo, C. D., & Di Blanco, Y. E. (2008). Local and continental correlates of the abundance of a neotropical cat, the ocelot (Leopardus pardalis). Journal of Tropical Ecology, 24(02), 189-200."
828,"Arrais, R. C., Widmer, C. E., Murray, D. L., Thornton, D., & Azevedo, F. C. C. D. (2022). Estimating density of ocelots in the Atlantic Forest using spatial and closed capture–recapture models. Journal of Mammalogy, 103(6), 1327-1337."
829,"Bolze, G. J., Tirelli, F. P., Queirolo, D., & Ramos Pereira, M. J. (2021). Living on the edge: density and activity patterns of the ocelot, Leopardus pardalis, in the austral limit of the Atlantic Forest. Studies on Neotropical Fauna and Environment, 1-14."
830,"Noss, A. J., Gardner, B., Maffei, L., Cuéllar, E., Montaño, R., Romero‐Muñoz, A., Sollman, A., O'Connell, A. F. (2012). Comparison of density estimation methods for mammal populations with camera traps in the K aa‐I ya del G ran C haco landscape. Animal Conservation, 15(5), 527-535."
831,"Vargas Soto, J. S., Flatt, E. J., Whitworth, A., Salom-Pérez, R., Espinoza-Muñoz, D., & Molnár, P. K. (2023). More than one way to count a cat: estimation of ocelot population density using frameworks for marked and unmarked species. Biodiversity and Conservation, 1-18."
832,"Boron, V., Bardales, R., Hyde, M., Jaimes-Rodriguez, L., Stasiukynas, D., Barragan, J., Passos Viana, D. F., Payán, E. (2022). The role of unprotected and privately protected areas for ocelot conservation: densities in Colombia and Brazil. Journal of Mammalogy, 103(3), 639-647."
833,"Penido G. et al. (2016). Density of ocelots in a semiarid environment in northeastern Brazil. Biota Neotropica, 16(4)."
834,"Gil-Sánchez, J. M., Jiménez, J., Salvador, J., Sánchez-Cerdá, M., & Espinosa, S. (2021). Structure and inter-specific relationships of a felid community of the upper Amazonian basin under different scenarios of human impact. Mammalian Biology, 101(5), 639-652."
835,"Aquino, R., & Calle, A. (2003). Evaluación del estado de conservación de los mamíferos de caza: Un modelo comparativo en comunidades de la Reserva Nacional Pacaya Samiria (Loreto, Perú). Revista peruana de biología, 10(2), 163-174."
836,"Rodgers, T. W., Giacalone, J., Heske, E. J., Janečka, J. E., Phillips, C. A., & Schooley, R. L. (2014). Comparison of noninvasive genetics and camera trapping for estimating population density of ocelots (Leopardus pardalis) on Barro Colorado Island, Panama. Tropical Conservation Science, 7(4), 690-705."
837,"Lombardi, J. V., Stasey, W. C., Caso, A., Carvajal-Villarreal, S., & Tewes, M. E. (2022). Ocelot density and habitat use in Tamaulipan thornshrub and tropical deciduous forests in Northeastern México. Journal of Mammalogy, 103(1), 57-67."
838,"Dillon, A., & Kelly, M. J. (2007). Ocelot Leopardus pardalis in Belize: the impact of trap spacing and distance moved on density estimates. Oryx, 41(04), 469-477."
839,"Amador-Alcalá, S. A., Amarillas, J. V., Falconi, F. A., Carreón-Arroyo, G., Coronel, C. M. V., & Monroy-Vilchis, O. (2022). Abundance and home range of ocelot (Leopardus pardalis) in northwestern Mexico. Animal Biology, 1(aop), 1-17."
840,"Trolle M., & Kéry M. (2003). Estimation of ocelot density in the Pantanal using capture-recapture analysis of camera-trapping data. Journal of mammalogy, 84(2), 607-614."
841,"Rocha, D. G. D., Sollmann, R., Ramalho, E. E., Ilha, R., & Tan, C. K. (2016). Ocelot (Leopardus pardalis) density in central Amazonia. PLoS One, 11(5), e0154624."
842,"Maffei, L., & Noss, A. J. (2008). How small is too small? Camera trap survey areas and density estimates for ocelots in the Bolivian Chaco. Biotropica, 40(1), 71-75."
843,"Kolowski, J. M., & Alonso, A. (2010). Density and activity patterns of ocelots (Leopardus pardalis) in northern Peru and the impact of oil exploration activities. Biological Conservation, 143(4), 917-925."
844,"Goulart, F. V. B., Graipel, M. E., Tortato, M. A., Ghizoni-Jr, I. R., Oliveira-Santos, L. G. R., & Cáceres, N. C. (2009). Ecology of the ocelot (Leopardus pardalis) in the Atlantic Forest of Southern Brazil. Neotropical Biology and Conservation, 4(3), 137-143."
845,"Greenspan, E., Anile, S., & Nielsen, C. K. (2020). Density of wild felids in Sonora, Mexico: a comparison of spatially explicit capture-recapture methods. European Journal of Wildlife Research, 66(4), 1-12."
846,"Oliveira-Santos, L. G. R., Graipel, M. E., Tortato, M. A., Zucco, C. A., Cáceres, N. C., & Goulart, F. V. (2012). Abundance changes and activity flexibility of the oncilla, Leopardus tigrinus (Carnivora: Felidae), appear to reflect avoidance of conflict. Zoologia (Curitiba), 29, 115-120."
847,"Horn, P. E., Pereira, M. J., Trigo, T. C., Eizirik, E., & Tirelli, F. P. (2020). Margay (Leopardus wiedii) in the southernmost Atlantic Forest: Density and activity patterns under different levels of anthropogenic disturbance. PloS one, 15(5), e0232013."
848,"Ramesh, T., & Downs, C. T. (2013). Impact of farmland use on population density and activity patterns of serval in South Africa. Journal of Mammalogy, 94(6), 1460-1470."
849,"Hardouin, M., Searle, C. E., Strampelli, P., Smit, J., Dickman, A., Lobora, A. L., & Rowcliffe, J. M. (2021). Density responses of lesser-studied carnivores to habitat and management strategies in southern Tanzania’s Ruaha-Rungwa landscape. PloS one, 16(3), e0242293."
850,"Kane, M. D. (2014). Estimating population size, density, and occupancy of lions (Panthera leo), leopards (P. pardus), and servals (Leptailurus serval) using camera traps in the Niokolo Koba National Park in Senegal, West Africa (Doctoral dissertation, Master’s Thesis, Virginia Tech)."
851,"Edwards, S., Portas, R., Hanssen, L., Beytell, P., Melzheimer, J., & Stratford, K. (2018). The spotted ghost: Density and distribution of serval Leptailurus serval in Namibia. African journal of ecology, 56(4), 831-840."
852,"Loock, D. J., Williams, S. T., Emslie, K. W., Matthews, W. S., & Swanepoel, L. H. (2018). High carnivore population density highlights the conservation value of industrialised sites. bioRxiv, 260729."
853,"Doran‐Myers, D., Kenney, A. J., Krebs, C. J., Lamb, C. T., Menzies, A. K., Murray, D., ... & Boutin, S. (2021). Density estimates for Canada lynx vary among estimation methods. Ecosphere, 12(10), e03774."
854,"Jedrzejewski, W., Jedrzejewska, B., Okarma, H., Schmidt, K., Bunevich, A. N., & Milkowski, L. (1996). Population dynamics (1869–1994), demography, and home ranges of the lynx in Bialowieza Primeval Forest (Poland and Belarus). Ecography, 19(2), 122-138."
855,"Palmero, S., et al. (2023). Shining a light on elusive lynx: Density estimation of three Eurasian lynx populations in Ukraine and Belarus. Ecology and Evolution, 13(11), e10688."
856,"Fležar, U., Aronsson, M., Černe, R., Pičulin, A., Bartol, M., Stergar, M., Rot, A., Hočevar, L., Topličanec, I., Sindičić, M., Gomerčić, T., Slijepčević, V., & Krofel, M. (2023). Using heterogeneous camera-trapping sites to obtain the first density estimates for the transboundary Eurasian lynx (Lynx lynx) population in the Dinaric Mountains. Biodiversity and Conservation, 32: 3199–3216"
857,"Weingarth, K., Heibl, C., Knauer, F., Zimmermann, F., Bufka, L., & Heurich, M. (2012). First estimation of Eurasian lynx (Lynx lynx) abundance and density using digital cameras and capture–recapture techniques in a German national park. Animal biodiversity and conservation, 35(2), 197-207."
858,"Gashchak, S., Barnett, C. L., Beresford, N. A., Paskevych, S., & Wood, M. D. (2022). Estimating the population density of Eurasian lynx in the Ukrainian part of the Chornobyl Exclusion Zone using camera trap footage. Theriologia Ukrainica, 23, 47-65."
859,"Pesenti, E., & Zimmermann, F. (2013). Density estimations of the Eurasian lynx (Lynx lynx) in the Swiss Alps. Journal of Mammalogy, 94(1), 73-81."
860,"Port, M., Tröger, C., & Hohmann, U. (2024). Status assessment of a recently reintroduced eurasian lynx (Lynx lynx) population in the Palatinate Forest, South-West Germany. European Journal of Wildlife Research, 70(3), 1-11."
861,"Truvé, J., & Cederlund, G. (2005). Mammals in the areas adjacent to Forsmark and Oskarshamn. Population density, ecological data and carbon budget (No. SKB-R--05-36). Swedish Nuclear Fuel and Waste Management Co.."
862,"Zimmermann, F., Dulex, N., Foresti, D., Breitenmoser-Würsten, C., Breitenmoser, U. (2014). Abondance et densité du lynx dans le Valais Nord: estimation par capture-recapture photographique dans le compartiment VII, durant l’hiver 2013/14. KORA Bericht Nr. 65"
863,"Pesenti, E., Genoud, J., Jordan, P., Maradan, F., Mauron, M., Peissard, E., Pharisa, M., Riedo, P., Romanens, P. (2017). Monitoring du lynx dans le canton de Fribourg. Hiver 2015-2016. Direction des institutions, de l’agriculture et des forêts DIAF"
864,"Kunz, F., Fattebert, J., Breitenmoser-Wursten, C., Breitenmoser, U. (2007). Abondance et densité du lynx: estimation par capture-recapture photographique dans le Nord du Jura suisse. KORA Bericht 37f"
865,"Kunz, F., Landolf, M., Steiner, M., Breitenmoser-Würsten, C., Breitenmoser, U., Zimmermann, F. (2016). Abondance et densité du lynx dans le Nord du Jura suisse : estimation par capture-recapture photographique dans le compartiment I, durant l’hiver 2015/16. KORA Bericht Nr. 75f"
866,"Iosif, R., Popescu, V. D., Ungureanu, L., Șerban, C., Dyck, M. A., & Promberger-Fürpass, B. (2022). Eurasian lynx density and habitat use in one of Europe’s strongholds, the Romanian Carpathians. Journal of Mammalogy, 103(2), 415-424."
867,"Zimmermann, F., Pesenti, E., Lanz, T., Breitenmoser-Würsten, C., Breitenmoser, U. (2012). Abondance et densité du lynx dans le Sud du Jura suisse: estimation par capturerecapture photographique dans le compartiment I, durant l’hiver 2011/12. KORA Bericht Nr. 58"
868,"Foresti, D., Lenarth, M., Breitenmoser-Würsten, C., Breitenmoser, U., Zimmermann, F. (2014). Abondance et densité du lynx dans le Centre du Jura suisse: estimation par capture-recapture photographique dans le compartiment I, durant l’hiver 2013/14. KORA Bericht Nr. 62"
869,"Garrote, G., de Ayala, R. P., Álvarez, A., Martín, J. M., Ruiz, M., de Lillo, S., & Simón, M. A. (2021). Improving the random encounter model method to estimate carnivore densities using data generated by conventional camera-trap design. Oryx, 55(1), 99-104."
870,"López-Parra, M., Fernández, L., Ruiz, G., Gil-Sánchez, J. M., Simón, M. A., López, G., & Sarmento, P. (2012). Change in demographic patterns of the Doñana Iberian lynx Lynx pardinus: management implications and conservation perspectives. Oryx, 46(3), 403-413."
